{
  "schema_version": 1,
  "run_id": "forecast-run-forecast-dillon-workload-daily-2026-09-02-origin-83",
  "request_id": "forecast-dillon-workload-daily-2026-09-02-origin-83",
  "as_of": "2026-09-02T14:15:16.890Z",
  "client_id": "portfolio/system",
  "series_id": "dillon-work-package-arrivals-daily",
  "frequency": "day",
  "model_id": "amazon/chronos-2",
  "provider_id": "amazon-science",
  "runtime_id": "chronos-forecasting==2.3.1;torch==2.6.0+cpu",
  "license_lane": "apache-2.0",
  "used_for": "research",
  "horizon": 7,
  "contains_client_series": false,
  "source_locators": [
    "_os/automation/config/work-package-profiles.json#updated=2026-09-02",
    "client-operations://deliverables/daily-category-counts#sha256=d58cc5d65bff84e252f6bbc2a506b73aab0178411b4a2c6993f53e5edba113d5",
    "holdout://origin-83-horizon-7"
  ],
  "status": "ok",
  "forbidden_uses": [
    "spend",
    "send",
    "publish",
    "conversion-claim"
  ],
  "target_outputs": [
    {
      "series_id": "work-packages-total",
      "point": [
        0.7995325922966003,
        0.7183327078819275,
        0.7653366327285767,
        0.7598350048065186,
        0.7824833393096924,
        0.6830646991729736,
        0.7207202315330505
      ],
      "quantiles": {
        "p10": [
          0.03869068622589111,
          0.03233158588409424,
          0.05024540424346924,
          0.04671323299407959,
          0.0377880334854126,
          0.04684436321258545,
          0.05238819122314453
        ],
        "p20": [
          0.12840569019317627,
          0.07680094242095947,
          0.10710060596466064,
          0.09829831123352051,
          0.08528757095336914,
          0.0828249454498291,
          0.09013521671295166
        ],
        "p30": [
          0.26491183042526245,
          0.18345290422439575,
          0.2230784296989441,
          0.20662111043930054,
          0.1927536129951477,
          0.17591261863708496,
          0.19247651100158691
        ],
        "p40": [
          0.48361659049987793,
          0.4039648175239563,
          0.4350775480270386,
          0.416980504989624,
          0.42225533723831177,
          0.3766406774520874,
          0.4026402235031128
        ],
        "p50": [
          0.7995325922966003,
          0.7183327078819275,
          0.7653366327285767,
          0.7598350048065186,
          0.7824833393096924,
          0.6830646991729736,
          0.7207202315330505
        ],
        "p60": [
          1.2518924474716187,
          1.1550930738449097,
          1.2072398662567139,
          1.2211514711380005,
          1.2625256776809692,
          1.1211355924606323,
          1.1667135953903198
        ],
        "p70": [
          1.9283924102783203,
          1.8321152925491333,
          1.9023350477218628,
          1.9336084127426147,
          1.9598993062973022,
          1.8367600440979004,
          1.9029176235198975
        ],
        "p80": [
          3.1977641582489014,
          2.985206365585327,
          3.070988178253174,
          3.1248528957366943,
          3.1362271308898926,
          3.061122417449951,
          3.201153516769409
        ],
        "p90": [
          5.865778923034668,
          5.25745964050293,
          5.3009538650512695,
          5.36027193069458,
          5.423474311828613,
          5.322885036468506,
          5.711175918579102
        ]
      }
    }
  ],
  "summary": "Chronos-2 CPU forecast completed with cross_learning=False; model load 0.2763s; forecast 0.8422s.",
  "artifact_paths": [
    "C:\\Users\\dillo\\Claude\\worktrees\\dillon-os-predictive-v2\\12_Brain\\state\\work-predictor\\chronos-2026-09-02-rolling-v2\\origins\\origin-83-run.json"
  ]
}